tmdb_id;tmdb_title;tmdb_original_title;tmdb_year;tmdb_release_date;premiere_date;premiere_country;premiere_note;tmdb_overview;tmdb_popularity;tmdb_vote_average;tmdb_vote_count
1093911;Nene revancha;Nene revancha;2023;7/3/2023;7/3/2023;AR;BAFICI;Una tragedia de venganza en la que los hijos pagan las faltas de sus padres. A partir del cruce casual entre dos internos de una colonia penitenciaria juvenil se desata una madeja que conducirá a un d;67183;4;2
1002459;El rapto;El rapto;2023;26/10/2023;2/9/2023;IT;Venice Film Festival;Basando en el libro homónimo de Martín Sivak. El 5 de diciembre de 1990 un grupo de obreros que levantaba un hotel en el centro de Buenos Aires vio cómo Jorge Sivak se lanzaba al vacío sin darles tiem;56628;6578;45
1179107;Trenque Lauquen;Trenque Lauquen;2023;15/9/2023;15/9/2023;BE;Film Fest Ghent Website;Para el proyecto único 2x25, el festival pidió a 25 compositores que compusieran una pieza musical corta, tras lo cual 25 cineastas hicieron un cortometraje. Un cortometraje de Laura Citarella con mús;43635;6;1
1196263;Deus Irae;Deus Irae;2023;3/11/2023;3/11/2023;AR;Festival Internacional de Cine de Mar del Plata;El Padre Javier revela que este sacerdote dedica su vida a visitar a familias que afirman haber visto cosas que no pertenecen a este mundo y a limpiar sus hogares de los demonios que intentan poseerlo;26078;66;5
1080566;El asistente;El asistente;2023;1/3/2023;1/3/2023;AR;Star+;Jimmy y Miguel se embarcan en una especie de camino del héroe en el que Miguel ayudará a su compañero, un rockero venido a menos, a encontrarle una cura a sus pesadillas y adicciones.;22456;88;5
1127842;El intercambio;El intercambio;2023;18/5/2023;16/11/2025;FR;Festival Chéries Chéris;Dos amigos, Mateo y Lucas, deciden salir de fiesta en una calurosa noche de verano. Luego Mateo conoce a Lucía y ocurre un hecho que altera sus vidas para siempre.;17749;5125;8
1110738;Terminal Young;Terminal Young;2023;22/4/2023;22/4/2023;AR;BAFICI;Una mujer que sufrió un incidente grave con una tenista violenta –en otro video de sí misma– ahora sale con un músico de jazz de Ramos Mejía retraído e inseguro, e igual ella está más fuerte y más con;12239;68;8
1120895;Nada de todo esto;Nada de todo esto;2023;17/5/2023;15/5/2024;FR;France 3 (Libre court);;10159;6;7
1197118;Quedate quieto o te amo;Quedate quieto o te amo;2023;5/11/2023;16/10/2025;DE;Hamburg International Queer Film Festival;Hasta los animales más insignificantes tienen intacto el instinto de supervivencia. Pero El Malincho no: este joven bandido busca desesperadamente refugio en el amor.;10032;10;1
1091079;El filo de las tijeras;El filo de las tijeras;2023;5/3/2023;5/3/2023;GR;Thessaloniki Documentary Festiva;Al modo de una aplicación de citas, un hombre se disecciona para construir una bitácora del deseo. Una peluquería del conurbano, el cruising y una trieja convergen en un relato que fluctúa entre la an;9808;2;1
1202565;No salgas;No salgas;2023;24/11/2023;24/11/2023;AR;Buenos Aires Rojo Sangre;Milagros una joven estudiante de teatro, deprimida por la trágica muerte de su padre inicia un viaje con amigos organizado por Juan, su novio, que quiere ayudarla a pasar un buen rato. Todo es tranqui;8613;9;5
995034;Turno nocturno;Turno nocturno;2023;3/10/2023;19/4/2023;AR;24° BAFICI;Tras una seguidilla de noches exhaustivas en el albergue transitorio Palo Alto, el Conserje nocturno se enfrentará a una noche atípica, la cual pondrá a prueba su desempeño laboral. La aparición de un;7462;62;4
1087420;El Santo;El Santo;2023;20/4/2023;20/4/2023;AR;BAFICI;Rubén es un curandero con un pasar humilde que atiende sus pacientes en un pequeño comercial donde también vive. Su fama es moderada, pero no sus técnicas de curación, que son extravagantes y perturba;6864;55;4
1114594;El sueño de la mariposa;El sueño de la mariposa;2023;25/4/2023;25/4/2023;BR;Fantaspoa;Franco (30) vive en una comunidad cerrada exclusiva con su esposa, Maia (30), con quien busca concebir. Habiéndose retirado joven después de vender su aplicación, Franco vive una vida de ocio y comodi;6714;0;0
997294;Cerrar los ojos;Cerrar los ojos;2023;16/8/2023;22/5/2023;FR;Cannes Film Festival;Años después de su misteriosa desaparición, Julio Arenas, un famoso actor español, vuelve a ser noticia gracias a un programa de televisión.;6302;7085;112
718608;Pájaros rojos;Pájaros rojos;2023;25/5/2023;25/5/2023;AR;Festival Internacional de Cine Político;"En la Argentina de los años 70, una joven poetisa escribe sobre pájaros rojos rodeados de fuego. Conoce a un carismático líder estudiantil; enamorados y unidos por sus ideales, sueñan con un mundo mej";6165;0;0
1111022;The Urgency of Death;The Urgency of Death;2023;27/4/2023;27/4/2023;AR;BAFICI;La hija del dueño de la tradicional confitería Ritz de La Plata –que trabajó en las farmacias Ojeda, Sarti, Santa Lucía, y ahora trabaja en la farmacia Santa Rosa– siente una total repulsión a convivi;5626;2;1
1205943;En El Mismísimo Momento;En El Mismísimo Momento;2023;13/11/2023;13/11/2023;NL;International Documentary Festival Amsterdam;Un niño criado en el monte quiere exprimir la realidad. El adentro y el afuera se trenzan en su mente mientras invoca sus obsesiones y captura lo que pasa a su alrededor con una cámara.;4757;0;0
936744;Animal Transport;Carga animal;2023;27/4/2023;27/4/2023;AR;BAFICI;Un transportista de animales descubre que dentro de una de las jaulas hay un animal sorprendentemente parecido a un humano. Mientras le recriminan su tardanza, tendrá que decidir si concretar o no la ;4454;6556;9
1210002;Como hombre;Como hombre;2023;23/11/2023;23/11/2023;AR;Buenos Aires Rojo Sangre.;;4429;0;0
1198710;Un zorro;Un zorro;2023;8/11/2023;8/11/2023;AR;Festival Internacional de Cine de Mar del Plata;Vera viaja con su madre y su hermana a ver un eclipse en el bosque, pero una extraña presencia hará que el miedo se apodere de ella. La niña es seducida por la naturaleza y se pierde en su inmensidad.;4374;0;0
898275;El hincha;El hincha;2023;23/4/2023;23/4/2023;AR;BAFICI;Renzo intenta acercarse al universo familiar y futbolero, el cual siempre le resultó ajeno. Así deambula entre su vida actual y la que podría haber tenido.;4112;2;1
1087253;Stories of the Argentine West;Amargo y Retruco;2023;1/12/2023;4/5/2024;AR;Festival Internacional de Cine Independiente de Cosquín | FICIC;En una taberna del interior Argentino, la xenofobia entre gauchos es la encargada de difuminar la linea entre la ley y la trampa.;4058;10;1
1086007;La Rosa y el Ciclón;La Rosa y el Ciclón;2023;24/11/2023;24/11/2023;AR;Centro Cultural San Martin;Rosita y Ciclón Jr. son dos wrestlers bolivianos que hacen catch en el barrio de Liniers. La lucha libre atraviesa sus vidas desde lo profesional, lo familiar y hasta lo romántico. Una historia de amo;4054;0;0
1111493;Un Andantino;Un Andantino;2023;22/4/2023;22/4/2023;AR;BAFICI;;4034;45;2
1112852;La Oscuridad Más Oscura;La Oscuridad Más Oscura;2023;8/10/2023;8/10/2023;AR;Festival de Cine de Ezeiza;;4019;0;0
1126230;El lugar de Nora;El lugar de Nora;2023;10/5/2023;10/5/2023;AR;En el festival La mujer y el Cine 35°;;3946;6;2
1196729;Siga, siga;Siga, siga;2023;11/11/2023;11/11/2023;AR;Festival Internacional de Cine de Mar del Plata;Luciana y Mariano son árbitros de fútbol. Su profesión obliga a que el error y la crítica constante convivan. Sin embargo, su pasión y amor por el juego hacen que sigan eligiendo continuar con su carr;3709;0;0
1196283;El pensamiento analógico;El pensamiento analógico;2023;4/11/2023;4/11/2023;AR;Festival Internacional de Cine de Mar del Plata;En un mundo donde el progreso tecnológico se concibe como una flecha hacia adelante, ¿por qué algunos se obstinan en seguir trabajando con esos equipos que otros llaman obsoletos? El pensamiento analó;3236;9;1
1198389;-Mamá…;-Mamá…;2023;8/11/2023;8/11/2023;AR;Festival Internacional de Cine de Mar del Plata;Ser mamá de Bahía ocupa casi todo su tiempo y espacio. Habiendo retomado la carrera de Arquitectura y las riendas de sí misma, sin dormir,estudiando todo el día, un deseo y un profundo secreto se fusi;3154;0;0
1198708;Todas las cosas que llevo conmigo;Todas las cosas que llevo conmigo;2023;8/11/2023;8/11/2023;AR;Festival Internacional de Cine de Mar del Plata;Víctor, un hombre huraño y obsesivo, se muda aun departamento en impecable estado. La primera noche, una mancha de humedad aparece en el techo inmaculado de su dormitorio. La mancha comienza a crecer ;3105;0;0
1048261;Carne de Dios;Carne de Dios;2023;13/11/2023;11/11/2022;AR;Mar del Plata Film Festival;Siglo XVII. En algún lugar perdido entre las montañas de México, un fraile católico que ha caído víctima de una extraña enfermedad es llevado por su discípulo nativo al hogar de una curandera indígena;2982;7;1
1106249;Nostalgia para el lago;Nostalgia para el lago;2023;24/4/2023;24/4/2023;AR;BAFICI;Un canoero flota entre el sueño y la vigilia en el lago infinito, teniendo de única compañía a su vieja radio. Su bote “Ara” (tiempo, en guaraní) viaja a través del tiempo como una estrella fugaz.;2947;6;2
848682;On / Off;On / Off;2023;18/11/2023;4/11/2021;GB;Ealing Film Festival;;2945;0;0
1194827;Darlo todo;Darlo todo;2023;28/10/2023;28/10/2023;AR;Festival Asterisco;“El drag es política pura”, sostiene una de les artistas que protagonizan este documental sobre el arte drag en Argentina a partir del concurso “Miss Lipsync Battle”, que se realiza en el bar Peuteo e;2918;0;0
1387807;Los mundos de Reni;Los mundos de Reni;2023;1/1/2023;12/10/2025;TW;Kaohsiung Film Festival;;2886;0;0
1110816;Otra película maldita;Otra película maldita;2023;21/4/2023;21/4/2023;AR;BAFICI;Una historia del cine de terror argentino, desde sus inicios en 1934 hasta la actualidad. Es un camino de derrotas, callejones sin salida y triunfos, donde los protagonistas nos conducirán por los pas;2884;64;5
1318049;El coste oculto;El cost amagat;2023;9/12/2023;9/12/2023;ES;Ecomuseu de les Valls d'Àneu;Un documental que recoge los impactos que la transición verde europea está teniendo en países como Chile y Argentina. Una invitación a escuchar los testimonios de quien padece este impacto pero sobre ;2855;0;0
1198713;Una edad difícil;Una edad difícil;2023;8/11/2023;8/11/2023;AR;Festival Internacional de Cine de Mar del Plata;Un fugitivo intenta enterrar un bolso en una es-cuela abandonada. No lo logra porque le disparan desde algún lugar cercano. Saca su revólver y devuelve el fuego.;2818;0;0
1196832;La próxima película de Carmen Trevilla;La próxima película de Carmen Trevilla;2023;8/11/2023;8/11/2023;AR;Festival Internacional de Cine de Mar del Plata;Iván es un productor de cine español que viaja a Argentina con una sola misión: encontrarse con Carmen Trevilla, una directora de culto que está en pleno proceso creativo de su nuevo “video”. Desde el;2796;78;4
1101443;El Dance Off;El Dance Off;2023;21/7/2023;21/7/2023;US;Outfest LA Film Festival;;2786;0;0
1211207;Sucesos violentos en el baño de un recital;Sucesos violentos en el baño de un recital;2023;30/11/2023;30/11/2023;AR;Festival Buenos Aires Rojo Sangre;;2771;0;0
1029724;My Pana;My Pana;2023;18/3/2023;18/3/2023;GB;BFI Flare;;2742;2;1
1375051;Antes que más grande;Antes que más grande;2023;30/9/2023;30/9/2023;AR;Festival Clave 13/17;Fran es un niño apasionado por el skate, quien parece tener una pequeña preocupación por llegar a cierta edad: “Para mí a los trece años empieza la edad difícil. A mi primo y a mi hermano les pasó. Te;2712;0;0
1360191;Brujas, ellas cruzarán el umbral;Brujas, ellas cruzarán el umbral;2023;28/11/2023;28/11/2023;AR;Buenos Aires Rojo Sangre;Un grupo de adolescentes se reúnen en una noche y comienzan a contar leyendas sobre brujas de diferentes países, pero en el transcurso, algo inesperado sucederá que cambiará sus vidas para siempre.;2696;0;0
1239244;Drown the Name;Drown the Name;2023;12/5/2023;12/5/2023;GR;Athens Digital Arts Festival;;2673;6;1
1196306;El empresario;El empresario;2023;9/11/2023;9/11/2023;AR;Festival Internacional de Cine de Mar del Plata;Argentina, 1976. En un operativo militar es liberado un empresario al mismo tiempo que es “desaparecido” el guerrillero que lo tenía secuestrado. Cuarenta años más tarde, Germán Scelso (realizador e h;2658;10;1
1197791;OUROBOROS: Un retrato imaginario de Marcelo Fox;OUROBOROS: Un retrato imaginario de Marcelo Fox;2023;25/10/2023;25/10/2023;AR;14° Festival REC- Festival de Estudiantes de Artes Audiovisuales de Universidades Públicas;En Buenos Aires, en la década de los 1960's, un poeta maldito desarrolla una corrosiva obra performática y recibe una condena social. Años más tarde, la violencia presente en sus escritos se hace carn;2621;10;1
1152578;Sobre nadar;Sobre nadar;2023;15/6/2023;15/6/2023;US;Philadelphia Latino Film Festival;Dominique es nadadora profesional de aguas abiertas. Está por cumplir su sueño de participar en los juegos olímpicos cuando queda embarazada. Ella deberá elegir entre su deseo, el mandato, y las presi;2509;5;1
1244226;La Primera Vigilia;La Primera Vigilia;2023;9/9/2023;9/9/2023;UY;Montevideo Fantastico;                                                                                                    ;2473;0;0
954857;Detrás de los Objetos;Detrás de los Objetos;2023;27/7/2023;27/7/2023;AR;Dento del marco del Festival Internacional de Cine de la UBA;;2441;10;1
1155525;Javier Milei: la revolución liberal;Javier Milei: la revolución liberal;2023;10/7/2023;10/7/2023;AR;Buenos Aires;Un retrato del político libertario argentino Javier Milei.;2441;37;6
1196231;Las ausencias;Las ausencias;2023;3/11/2023;3/11/2023;AR;Festival Internacional de Cine de Mar del Plata;La vida de Juan José Gorasurreta está atravesada por las imágenes. En su nuevo largometraje, el histórico cineclubista se apropia de las películas que lo formaron para encontrar relaciones y patrones ;2407;0;0
1051674;Freno & Reversa;Freno & Reversa;2023;19/7/2023;19/7/2023;US;SWIFF (Student World Impact Film Festival);En un viaje nocturno, la relación entre madre e hija se verá puesta a prueba.;2397;0;0
1066914;Eyestring;Eyestring;2023;10/3/2023;10/3/2023;US;SXSW;;2355;87;3
1196286;Una habitación llena de polvo;Una habitación llena de polvo;2023;5/11/2023;5/11/2023;AR;Festival Internacional de Cine de Mar del Plata;Agustín, un dibujante de historietas, no quiere seguir dibujando. Quizás sea un hombre sin talento, o sencillamente no tiene ganas. Un día sueña que se mete en la casa que compartía con su exnovia. Es;2316;0;0
1196308;Lava 2 (El nuevo show del Narciso);Lava 2 (El nuevo show del Narciso);2023;9/11/2023;9/11/2023;AR;Festival Internacional de Cine de Mar del Plata;Los medios de comunicación masivos fueron invadidos por la Cultura Lacrimal. Internet, la televisión y la radio quedaron interrumpidas por una señal invasora. Una imagen inundaba las pantallas: Nunca ;2309;10;1
1188309;Detrás de escena;Detrás de escena;2023;2/9/2023;7/10/2023;AR;Enerc Se Proyecta;"Una joven estudiante de actuación que se prepara para su debut escénico; encarnará a la intrépida Adela en ""La casa de Bernarda Alba"":  Impulsada por los nervios y la ansiedad, acepta la propuesta de ";2219;0;0
1202685;Tencha Reina;Tencha Reina;2023;26/10/2023;26/10/2023;AR;Festival Asterisco;Una autoficción sobre Tencha de Sagastizabal: psicoanalista, actriz, chamana y gorda. La peli es un retrato onírico sensual, mágico e iridiscente. Un híbrido que muta a fábula. Un cuento de hadas quee;2201;0;0
1190158;El portador;El portador;2023;15/10/2023;15/10/2023;AR;Tandil Cine;Guille es un repartidor nocturno a quien se le encarga una misión peligrosa pero importantísima: debe llevar un cofre misterioso a una dirección al otro lado de la ciudad. El joven vivirá la noche más;2165;0;0
1388193;Intrusión;Intrusión;2023;25/11/2023;25/11/2023;AR;Buenos Aires Rojo Sangre ;;2137;0;0
1209186;Sapos, momentos de infancia en dictadura;Sapos, momentos de infancia en dictadura;2023;21/11/2023;21/11/2023;CL;FICVIÑA;A 40 años del retorno de la democracia en Argentina, Lucas, Sonia, Tália, Iván, Nadia, Damián y Bruno se encuentran a grabar historias sobre sus infancias en dictadura. Textos que dialogan con filmaci;2094;0;0
1162032;Rojas;Rojas;2023;5/8/2023;5/8/2023;CA;Fantasia Film Festival;;2067;0;0
1168331;Tortugas;Tortugas;2023;21/4/2023;21/4/2023;AR;Selección Oficial Festival Internacional de Cine del Fin del Mundo;Una historia familiar a través de la relación con las ciudades y las tortugas.;1956;0;0
1172694;Hacer orillas luminosas;Hacer orillas luminosas;2023;8/11/2023;7/10/2023;AR;FIDBA Film Fest;Imágenes térmicas capturadas por la realizadora exponen los desplazamientos nocturnos llevados a cabo por mujeres paseras en la frontera argentino-paraguaya. Un testimonio subversivo que expresa visua;1926;0;0
1137745;Las apariencias;Las apariencias;2023;1/7/2023;13/3/2024;DK;CPH:DOX Intl. Premiere;;1914;0;0
1492361;Mil rostros;Mil rostros;2023;19/10/2023;19/10/2023;AR;UNLP;;1904;0;0
1111059;Nunca hizo tanto frío;Nunca hizo tanto frío;2023;2/6/2023;25/4/2023;AR;BAFICI;;1882;0;0
1166369;La música está servida: Sofía Carson;La música está servida: Sofía Carson;2023;8/9/2023;8/9/2023;AR;Disney+;;1797;77;13
1213813;Sofía;Sofía;2023;13/12/2023;13/12/2023;AR;Cine Gaumont;;1789;0;0
1183806;Desierto;Desierto;2023;28/9/2023;28/9/2023;AR;La Plata International Independent Film Festival - FestiFreak;Desierto deriva del prefijo De: separación, y el verbo Serere: entretejer o enlazar. Camino y recopilo imágenes para comprender el lugar del que vengo, la estepa patagónica en las afueras de Comodoro ;1757;8;1
1172691;Acuario;Acuario;2023;8/9/2023;8/9/2023;AR;FICPBA;Luisa vive en una ciudad tradicional en los comienzos del Nuevo Milenio. Envuelta en una atmósfera de monotonía queda al descubierto el hastío con el que carga: su deseo parece haberse evaporado. Encu;1748;0;0
1117662;Regreso en Patagonia;Regreso en Patagonia;2023;1/4/2023;1/4/2023;AR;TEATRIX;;1724;2;1
1202603;The Hunt;The Hunt;2023;21/9/2023;21/9/2023;US;New York Latino Film Festival;El viaje de fin de semana de Jessica y Olivia se convierte en una pesadilla cuando son perseguidas por un asesino enloquecido en el desierto.;1657;0;0
1191363;Es Gourmet;Es Gourmet;2023;23/11/2023;23/11/2023;AR;Festival Rojo Sangre XXIV;"""Es Gourmet"" presenta su ulttimo programa, donde El Cocinero prepara un plato especial con la ayuda de su camarografa Juana y un subscriptor y fan del show, Mario. Pero el platillo puede no ser del gu";1624;0;0
1146283;Callejero Fino;Callejero Fino;2023;2/7/2023;2/7/2023;AR;STAR+ LIVE;;1593;0;0
1111125;Alguien en el mundo piensa en mí;Alguien en el mundo piensa en mí;2023;23/4/2023;23/4/2023;AR;At the Buenos Aires International Film Festival;Alejandro Vilas es un músico y profesor de matemáticas que, según algunos, es físicamente idéntico a su ídolo argentino local: Charly García.;1563;35;2
1196830;Los sueños de Elma: Historia de una madre de Malvinas;Los sueños de Elma: Historia de una madre de Malvinas;2023;6/11/2023;6/11/2023;AR;Festival Internacional de Cine de Mar del Plata;Geoffrey Cardozo (inglés) y Julio Aro (argentino) están postulados al Premio Nobel de la Paz compartido por su trabajo en una causa humanitaria histórica: la restitución de identidades de caídos argen;1557;0;0
1208807;Rouge;Rouge;2023;24/11/2023;24/11/2023;AR;Festival Buenos Aires Rojo Sangre;Una noche en Buenos Aires, una mujer presencia como su vecina de se cae del balcón. Ella decide ayudarla. Lo que en principio parecía un accidente se convierte en una pesadilla.;1488;0;0
1340026;La Noche de Anoche;La Noche de Anoche;2023;4/12/2023;4/12/2023;AR;Cine Centro Cultural San Martín;Un joven neurótico y fan de Star Wars llamado Lautaro, recién mudado con su novia Lucía, va a una fiesta y toma cerveza hasta perder la memoria. Al despertar, tiene recuerdos confusos con una chica ll;1485;0;0
1190499;¡¿Quién es?!;¡¿Quién es?!;2023;24/11/2023;24/11/2023;AR;Buenos Aires Rojo Sangre;Pamela y Verónica pasan el fin de semana en una casa en medio de la nada, pero su escapada romántica da un giro aterrador cuando un desconocido golpea la puerta. TOC-TOC-TOC.;1435;0;0
1198390;Sachasandia;Sachasandia;2023;8/11/2023;8/11/2023;AR;Festival Internacional de Cine de Mar del Plata;Una joven wichí se deja llevar por la provocación de los criollos y el malestar de su mejor amiga. Re-chaza el conocimiento ancestral sobre la cocción de la sachasandia, un fruto silvestre que puede s;1414;0;0
1310665;SIN FUTURO MIENTRAS TANTO;SIN FUTURO MIENTRAS TANTO;2023;18/10/2023;12/7/2024;AR;Enerc Se Proyecta 2024;La misma voz que recita un poema de furia y desencanto es la que convierte un centro cultural en un espacio de libertad y alegría compartida. Entre las contradicciones del arte, la contracultura, y la;1408;0;0
1209088;Defunción Privada;Defunción Privada;2023;23/11/2023;23/11/2023;AR;Festival Buenos Aires Rojo Sangre;Francina, la empleada de un cine antiguo, invita a Mateo a una proyección de trasnoche solo para ellos.  Lo que no saben es que, en las penumbras del establecimiento, los espera un asesino despiadado ;1376;0;0
1202124;Los turistas, una temporada en el infierno;Los turistas, una temporada en el infierno;2023;25/11/2023;25/11/2023;AR;Buenos Aires Rojo Sangre;Un grupo de amigos se va de viaje de vacaciones a un pueblo en medio del bosque. Todo parece ir según lo previsto hasta que deciden asistir a un espectáculo callejero de terror que cambiará sus vidas ;1309;0;0
1188305;Dora Seguel;Dora Seguel;2023;7/10/2023;7/10/2023;AR;Enerc Se Proyecta;;1265;0;0
1188314;Espíritu imperecedero;Espíritu imperecedero;2023;8/10/2023;8/10/2023;AR;Enerc Se Proyecta;Corto de la ENERC;1257;0;0
1394100;Iris;Iris;2023;26/8/2023;26/8/2023;AR;Museo de Arte Moderno de Buenos Aires;;1253;0;0
1094357;El tropezón;El tropezón;2023;22/4/2023;22/4/2023;AR;In BAFICI 24º;;1196;8;1
1106872;El clan Vega;El clan Vega;2023;24/4/2023;24/4/2023;AR;BAFICI;Relato basado en el derrotero criminal de una temible familia nómada. Inspirado en hechos verídicos, retrata la vulnerabilidad de las personas ante la inoperancia de las instituciones del Estado.;1135;1;1
1110763;Tu coño;Tu coño;2023;21/4/2023;21/4/2023;AR;BAFICI;Una obra cinematográfica poco convencional en la que, a través de varias capas narrativas que se entrelazan, el director nos ofrece una mirada muy particular sobre un tema que aún hoy sigue siendo tab;1133;3857;7
984612;El canto del cisne;El canto del cisne;2023;10/6/2023;10/6/2023;BG;In the Palace International Short Film Festival;Lucas y Javier son una pareja que durante el tiempo compartido han vivido una variedad de experiencias pero ninguna los ha marcado tanto como afrontar la pérdida de un familiar muy cercano.;1126;0;0
1188311;Ambar;Ambar;2023;7/10/2023;7/10/2023;AR;Enerc Se Proyecta;Corto de la ENERC;1102;0;0
1172144;Ahru;Ahru;2023;8/10/2023;15/10/2023;GB;BFI London Film Festival;;1093;6;1
1197172;La esperanza;La esperanza;2023;7/10/2023;11/2/2023;AR;Marco Verano Cultural 2023 San Juan;Semita (50), un informático recién salido de prisión, desea ir a ver a su hija Ámbar (24) y recuperar el tiempo perdido, pero se entera que vive en España. Pocho (50), un antiguo compañero de robo, le;1086;0;0
1209838;Subastas al Atardecer;Subastas al Atardecer;2023;7/12/2023;7/12/2023;EC;Festival Internacional de Cine Estudiantil de Naranjal;Una aficionada al fútbol intenta ayudar a su amigo a formar parte de la Asociación de Coleccionistas de Camisetas de Fútbol.;1037;0;0
1051179;Malcriada;Malcriada;2023;1/12/2023;1/12/2023;BR;Festival Internacional de Cinema de Goiânia;"""Malcriada"" forma parte de la trilogía ""Amor Animal"", junto a ""Otro Hermano"" y ""Reina"". En esta serie, se abordan distintas facetas del amor y la soledad encarnado en tres mujeres distintas, cada una ";999;0;0
1198385;Cachirú;Cachirú;2023;8/11/2023;8/11/2023;AR;Festival Internacional de Cine de Mar del Plata;En el verano en el que desaparece una adolescente, Popi y sus amigos conocen el mito del Cachirú. La fantasía se entremezclará con la tragedia real en los juegos del grupo.;988;0;0
1182110;Caradeloca;Caradeloca;2023;20/9/2023;25/10/2025;ES;Curtas Festival do Imaxinario;En un colegio de mujeres, el status quo de 3er año es alterado cuando Constanza, la líder de la división, muere en un accidente. Lucrecia, la menos popular, encuentra una manera extraña de evadir el a;978;0;0
1198715;Xini;Xini;2023;8/11/2023;8/11/2023;AR;Festival Internacional de Cine de Mar del Plata;Xini se encuentra moribundo después de haber recibido un disparo. Un extraño joven lo rescata y guía hacia una isla remota donde iniciará un viaje de transformación.;963;0;0
1053426;Conversaciones sobre el odio;Conversaciones sobre el odio;2023;20/10/2023;20/4/2023;AR;BAFICI;Basada en el test de Bechdel, Conversaciones sobre el odio es un thriller psicológico que narra en tiempo real el último encuentro entre dos mujeres. Un manifiesto contra la discriminación de la gente;957;10;1
1308519;Esto no soy yo;Esto no soy yo;2023;18/11/2023;18/11/2023;AR;Festival Cartón;4ta sesión de terapia.  Manuel empieza a creer que no funcionan.  Va a seguir intentando.  Hasta que sus manos se vuelvan de acero.;956;0;0
883111;Las almas;Las almas;2023;10/11/2023;10/11/2023;AR;Festival Internacional de Cine de Mar del Plata;Sobre los paisajes entre marcianos y lunares del noroeste argentino, la voz de una mujer cuenta su historia. Un relato en el que la memoria se funde con lo onírico y donde el cándido existencialismo d;905;0;0
